{
  "schema_version": "atlas.apollo-remote-operator-continuity.v1",
  "primary_endpoint": "APOLLO_WINDOWS_NATIVE_VSCODE_AND_GLASS_CLIENT",
  "independent_operator": "HERMES_PORTABLE_ADMIN_AND_PRIME_RECOVERY",
  "nonblocking_clients": ["IRIS", "ZEUS"],
  "remote_route": ["SEPARATELY_GOVERNED_PRIVATE_ROUTE", "NO_PUBLIC_EXPOSURE", "NO_MICROSOFT_REMOTE_TUNNELS_DEPENDENCY"],
  "environment_isolation": ["PRIVATE", "ENGINEERING", "WORLDHOPPER"],
  "isolation_dimensions": ["CREDENTIALS", "WORKSPACES", "PROCESSES", "EXTENSION_STORAGE", "CACHES", "CLEANUP", "REVOCATION"],
  "startup_order": ["WINDOWS_AND_STORAGE_HEALTH", "APPROVED_IDENTITY_AND_PRIVATE_ROUTE", "PROFILE_ISOLATION", "VSCODE_COMPATIBILITY", "VERIFIED_LOCAL_GLASS_PACKAGE", "GOVERNED_API_AUTHENTICATION"],
  "shutdown_order": ["STOP_INTERACTIVE_JOBS_AND_SESSIONS", "DISPOSITION_APPROVED_WORK", "REVOKE_EPHEMERAL_ACCESS", "CLEAN_OR_QUARANTINE_PROTECTED_CACHES", "CLOSE_GLASS_AND_VSCODE", "SHUT_DOWN_WINDOWS"],
  "prohibited_unique_state": ["PROTECTED_ORIGINAL", "MISSION_STATE", "COPPERMIND_STATE", "CREDENTIAL", "CANONICAL_REPOSITORY", "UNPUSHED_COMMIT", "UNIQUE_BRANCH", "SOLE_WORKING_COPY"],
  "recovery_assets": ["VERIFIED_VERSIONED_GLASS_INSTALLER", "KNOWN_GOOD_ROLLBACK_PACKAGE", "WINDOWS_RECOVERY_MEDIA_DISPOSITION", "MANUFACTURER_DRIVER_SOURCE", "SYSTEM_IMAGE_DISPOSITION"],
  "degraded_behavior": ["APOLLO_LOSS_REMOVES_GUI_AND_WINDOWS_WORK_ONLY", "REMOTE_ROUTE_LOSS_USES_LOCAL_APOLLO_OR_HERMES", "GLASS_ROLLBACK_DOES_NOT_REVERT_BACKEND", "PERSISTENT_SERVICES_CONTINUE", "PRIME_CLEAN_CLONE_RECOVERY_CONTINUES"],
  "required_runtime_proof": ["NATIVE_VSCODE", "WINDOWS_SPECIFIC_WORKFLOW", "VERIFIED_GLASS_INSTALL", "BOUNDED_PRIVATE_CLIENT_ACCESS", "ENVIRONMENT_ISOLATION_AND_CLEANUP", "APOLLO_RESTART_AND_LOSS", "HERMES_INDEPENDENT_ADMIN_AND_RECOVERY", "SOURCE_INVENTORY_AND_DISPOSITION", "WINDOWS_RECOVERY_POSTURE"],
  "runtime_state": "PENDING_PROTECTED_EXECUTE",
  "pf_c01_m02_state": "READY_FOR_PREVIEW_NOT_PROVEN"
}
